{
  "$schema": "./traceability-v1.schema.json",
  "traceability_id": "converact-goal-03-traceability-v1",
  "version": "1.0.0",
  "generated_at": "2026-08-02T00:00:00.000Z",
  "binding": {
    "goal_path": "goals/goal-03-sip-call-durable-foundation.md",
    "goal_sha256": "05ce7f940782ab0efcd013d413220d068a7d3be1bab981f2c2c4f6a6f2a217af",
    "amendment_path": "goals/amendments/2026-08-02-g02-g03-gate-split-v1.json",
    "amendment_sha256": "3f55c9afdc2af68d8a93a5cfe19311cb9aaefb63192c85475d479af98fa2049b",
    "manifest_path": "goals/manifest.json",
    "manifest_sha256": "11b026b5014dc344d4e5b2459aafc0b251190075a212fc68f40dce62fbbda912",
    "g02_development_gate_commit": "16ab4af98c5f3b453ad3d9bdd1ae5fe959a37720",
    "gate_split_commit": "e5f4c81e8eb796131313aab8f5b3a47231fe41b7"
  },
  "source_traceability": {
    "path": "architecture-foundation/execution/goal-00/requirement-traceability-v1.json",
    "sha256": "d5fbafcb5ee97530928e999f1dbf7e9a268293558026977f6e9b07c5e5895edf"
  },
  "requirements": [
    {
      "requirement_id": "R4:001:HISTORICAL_OBJECTIVE:GOALS_4_THROUGH_11",
      "source_id": "R4_TRACEABILITY",
      "source_path": "docs/capacity/contracts/unified-voice-foundation-r4-traceability-v1.json",
      "source_pointer": "/rows/0",
      "requirement": "Execute Goals 4 through 11 from `docs/design/communication-foundation-vos5000-parity-performance-plan.md` in dependency order.",
      "source_prior_status": "historical_superseded",
      "source_evidence_status": "not_run",
      "g03_domain": "legacy_assessment",
      "implementation_paths": [
        "architecture-foundation/execution/goal-03/source-test-path-map.md"
      ],
      "test_paths": [
        "architecture-foundation/execution/goal-03/goal-03-contract.test.mjs"
      ],
      "status": "not_run",
      "evidence_uris": [],
      "production_eligible": false,
      "rationale": "Mapped exactly once; no G00 or historical evidence is requalified by G03."
    },
    {
      "requirement_id": "R4:002:BASELINE_REVIEW:DECISION_01_AUTHORITY_BOUNDARY",
      "source_id": "R4_TRACEABILITY",
      "source_path": "docs/capacity/contracts/unified-voice-foundation-r4-traceability-v1.json",
      "source_pointer": "/rows/1",
      "requirement": "锁定的是 Authority，不是某个库",
      "source_prior_status": "target",
      "source_evidence_status": "not_run",
      "g03_domain": "wire_security",
      "implementation_paths": [
        "src/agent-runtime/converact/voice/sip-foundation/route-binding.ts",
        "src/agent-runtime/converact/voice/sip-foundation/rsipstack-adapter.ts",
        "architecture-foundation/execution/goal-03/wire-corpus"
      ],
      "test_paths": [
        "test/converact-sip-foundation.test.ts",
        "architecture-foundation/execution/goal-03/goal-03-contract.test.mjs"
      ],
      "status": "not_run",
      "evidence_uris": [],
      "production_eligible": false,
      "rationale": "Mapped exactly once; no G00 or historical evidence is requalified by G03."
    },
    {
      "requirement_id": "R4:007:BASELINE_REVIEW:DECISION_06_FAST_DECODE_PATH_SEPARATION",
      "source_id": "R4_TRACEABILITY",
      "source_path": "docs/capacity/contracts/unified-voice-foundation-r4-traceability-v1.json",
      "source_pointer": "/rows/6",
      "requirement": "普通快路径和解码路径要彻底分开",
      "source_prior_status": "target",
      "source_evidence_status": "not_run",
      "g03_domain": "legacy_assessment",
      "implementation_paths": [
        "architecture-foundation/execution/goal-03/source-test-path-map.md"
      ],
      "test_paths": [
        "architecture-foundation/execution/goal-03/goal-03-contract.test.mjs"
      ],
      "status": "not_run",
      "evidence_uris": [],
      "production_eligible": false,
      "rationale": "Mapped exactly once; no G00 or historical evidence is requalified by G03."
    },
    {
      "requirement_id": "R4:009:BASELINE_REVIEW:DECISION_08_RUSTPBX_DEFOUNDATION",
      "source_id": "R4_TRACEABILITY",
      "source_path": "docs/capacity/contracts/unified-voice-foundation-r4-traceability-v1.json",
      "source_pointer": "/rows/8",
      "requirement": "RustPBX主干仍可保留，但要逐步“去底座化”",
      "source_prior_status": "target",
      "source_evidence_status": "not_run",
      "g03_domain": "legacy_assessment",
      "implementation_paths": [
        "architecture-foundation/execution/goal-03/source-test-path-map.md"
      ],
      "test_paths": [
        "architecture-foundation/execution/goal-03/goal-03-contract.test.mjs"
      ],
      "status": "not_run",
      "evidence_uris": [],
      "production_eligible": false,
      "rationale": "Mapped exactly once; no G00 or historical evidence is requalified by G03."
    },
    {
      "requirement_id": "R4:010:BASELINE_REVIEW:DECISION_09_FREEZE_ARCHITECTURE_ADR",
      "source_id": "R4_TRACEABILITY",
      "source_path": "docs/capacity/contracts/unified-voice-foundation-r4-traceability-v1.json",
      "source_pointer": "/rows/9",
      "requirement": "建议正式冻结的架构决议",
      "source_prior_status": "target",
      "source_evidence_status": "not_run",
      "g03_domain": "legacy_assessment",
      "implementation_paths": [
        "architecture-foundation/execution/goal-03/source-test-path-map.md"
      ],
      "test_paths": [
        "architecture-foundation/execution/goal-03/goal-03-contract.test.mjs"
      ],
      "status": "not_run",
      "evidence_uris": [],
      "production_eligible": false,
      "rationale": "Mapped exactly once; no G00 or historical evidence is requalified by G03."
    },
    {
      "requirement_id": "R4:011:BASELINE_REVIEW:FINAL_JUDGMENT",
      "source_id": "R4_TRACEABILITY",
      "source_path": "docs/capacity/contracts/unified-voice-foundation-r4-traceability-v1.json",
      "source_pointer": "/rows/10",
      "requirement": "最终判断",
      "source_prior_status": "target",
      "source_evidence_status": "not_run",
      "g03_domain": "legacy_assessment",
      "implementation_paths": [
        "architecture-foundation/execution/goal-03/source-test-path-map.md"
      ],
      "test_paths": [
        "architecture-foundation/execution/goal-03/goal-03-contract.test.mjs"
      ],
      "status": "not_run",
      "evidence_uris": [],
      "production_eligible": false,
      "rationale": "Mapped exactly once; no G00 or historical evidence is requalified by G03."
    },
    {
      "requirement_id": "R4:012:MARKDOWN_GATE:GOAL0.ACCEPTANCE.01",
      "source_id": "R4_TRACEABILITY",
      "source_path": "docs/capacity/contracts/unified-voice-foundation-r4-traceability-v1.json",
      "source_pointer": "/rows/11",
      "requirement": "不使用浮动分支构建；",
      "source_prior_status": "target",
      "source_evidence_status": "not_run",
      "g03_domain": "legacy_assessment",
      "implementation_paths": [
        "architecture-foundation/execution/goal-03/source-test-path-map.md"
      ],
      "test_paths": [
        "architecture-foundation/execution/goal-03/goal-03-contract.test.mjs"
      ],
      "status": "not_run",
      "evidence_uris": [],
      "production_eligible": false,
      "rationale": "Mapped exactly once; no G00 or historical evidence is requalified by G03."
    },
    {
      "requirement_id": "R4:013:MARKDOWN_GATE:GOAL0.ACCEPTANCE.02",
      "source_id": "R4_TRACEABILITY",
      "source_path": "docs/capacity/contracts/unified-voice-foundation-r4-traceability-v1.json",
      "source_pointer": "/rows/12",
      "requirement": "spike 覆盖内核转发、用户态降级和不确定命令结果；",
      "source_prior_status": "target",
      "source_evidence_status": "not_run",
      "g03_domain": "legacy_assessment",
      "implementation_paths": [
        "architecture-foundation/execution/goal-03/source-test-path-map.md"
      ],
      "test_paths": [
        "architecture-foundation/execution/goal-03/goal-03-contract.test.mjs"
      ],
      "status": "not_run",
      "evidence_uris": [],
      "production_eligible": false,
      "rationale": "Mapped exactly once; no G00 or historical evidence is requalified by G03."
    },
    {
      "requirement_id": "R4:014:MARKDOWN_GATE:GOAL0.ACCEPTANCE.03",
      "source_id": "R4_TRACEABILITY",
      "source_path": "docs/capacity/contracts/unified-voice-foundation-r4-traceability-v1.json",
      "source_pointer": "/rows/13",
      "requirement": "测试骨架能产生可 reconciliation 的 attempted/connected/failed/active 证据；",
      "source_prior_status": "target",
      "source_evidence_status": "not_run",
      "g03_domain": "effect_receipt",
      "implementation_paths": [
        "src/agent-runtime/converact/voice/sip-foundation/effect-oracle.ts",
        "src/agent-runtime/converact/voice/sip-foundation/postgres-effect-store.ts",
        "src/migrations/107_ivekit_sip_effect_oracle.sql",
        "src/migrations/113_converact_sip_effect_transport_completed.sql",
        "src/migrations/114_converact_sip_effect_transport_completed_validate.sql",
        "src/migrations/115_converact_sip_effect_stale_nonterminal_recovery.sql"
      ],
      "test_paths": [
        "test/converact-sip-receipt-drain.test.ts",
        "test/converact-sip-effect-oracle.test.ts",
        "test/converact-sip-effect-postgres.test.ts"
      ],
      "status": "not_run",
      "evidence_uris": [],
      "production_eligible": false,
      "rationale": "Mapped exactly once; no G00 or historical evidence is requalified by G03."
    },
    {
      "requirement_id": "R4:015:MARKDOWN_GATE:GOAL0.ACCEPTANCE.04",
      "source_id": "R4_TRACEABILITY",
      "source_path": "docs/capacity/contracts/unified-voice-foundation-r4-traceability-v1.json",
      "source_pointer": "/rows/14",
      "requirement": "metrics schema 固定 type、unit、label、bucket 和 clock metadata；",
      "source_prior_status": "target",
      "source_evidence_status": "not_run",
      "g03_domain": "effect_receipt",
      "implementation_paths": [
        "src/agent-runtime/converact/voice/sip-foundation/effect-oracle.ts",
        "src/agent-runtime/converact/voice/sip-foundation/postgres-effect-store.ts",